{
  "day": 9,
  "topic": "Familie und Freundschaft",
  "lesen": {
    "teil1": {
      "title": "Drei Generationen unter einem Dach",
      "source": "Blog",
      "text": "Seit genau einem Jahr wohnen wir im Haus meiner Eltern. Als mein Vater vor zwei Jahren krank wurde, haben wir lange darüber gesprochen, wie es weitergehen soll. Das Haus war für meine Eltern allein zu groß geworden, und wir – mein Mann, unsere Tochter Emma und ich – wohnten in einer teuren Dreizimmerwohnung am anderen Ende der Stadt. Die Entscheidung war am Ende einfach: Meine Eltern haben sich im Erdgeschoss eine kleine Wohnung eingerichtet, wir wohnen oben im ersten Stock.\n\nDer größte Vorteil ist Emma. Sie ist sechs und geht nach der Schule direkt zu ihrer Oma, die mit ihr Hausaufgaben macht und Kuchen backt. Wir müssen niemanden mehr für die Betreuung bezahlen. Mein Vater hat mit meinem Mann im Sommer ein Baumhaus im Garten gebaut. Die beiden verstehen sich besser, als ich erwartet hatte.\n\nNatürlich gab es auch Konflikte. Meine Mutter hat Emma anfangs jeden Tag Süßigkeiten gegeben, obwohl wir das nicht wollten. Irgendwann haben wir ein langes Gespräch geführt, und seitdem gibt es die Schokolade nur noch am Wochenende. Wir haben außerdem eine Regel gefunden: Jede Familie hat ihren eigenen Eingang, und man klingelt, bevor man hineingeht. Nur am Sonntag frühstücken wir alle zusammen, und einmal pro Woche essen wir gemeinsam zu Abend – meistens kocht mein Vater.\n\nMeine Freundinnen fragen oft, ob mir die Privatsphäre nicht fehlt. Manchmal schon, das gebe ich zu. Aber wenn ich abends höre, wie Emma unten mit ihrer Oma lacht, dann weiß ich, dass wir das Richtige getan haben. Zurück in die alte Wohnung möchte niemand von uns.",
      "items": [
        {"id": "L1-1", "statement": "Die Familie wohnt seit einem Jahr im Haus der Eltern der Autorin.", "answer": true, "skill": "number-time"},
        {"id": "L1-2", "statement": "Die Eltern der Autorin wohnen im ersten Stock.", "answer": false, "skill": "detail"},
        {"id": "L1-3", "statement": "Emma geht nach der Schule zu ihrer Großmutter.", "answer": true, "skill": "detail"},
        {"id": "L1-4", "statement": "Über die Erziehung von Emma gab es nie Streit.", "answer": false, "skill": "negation"},
        {"id": "L1-5", "statement": "Die beiden Familien essen jeden Abend zusammen.", "answer": false, "skill": "number-time"},
        {"id": "L1-6", "statement": "Die Autorin ist mit der Entscheidung zufrieden.", "answer": true, "skill": "attitude"}
      ]
    },
    "teil2": {
      "texts": [
        {
          "title": "Oma auf Zeit",
          "source": "Zeitung",
          "text": "Jeden Dienstag um halb drei steht Hildegard Meier vor der Kita „Pusteblume“ in Münster und holt zwei Kinder ab, die nicht ihre Enkel sind. Die 72-Jährige ist „Leihoma“ bei Familie Ruiz. Die echten Großeltern der Kinder leben in Spanien und in Hamburg, und die Eltern arbeiten beide Vollzeit. Vermittelt hat den Kontakt der Verein „Generationen verbinden“, der in Münster inzwischen über 120 solcher Partnerschaften organisiert hat.\n\nDie Idee ist einfach: Ältere Menschen, die Zeit haben und Kinder mögen, helfen Familien, deren Großeltern weit weg wohnen oder nicht mehr leben. Geld gibt es dafür nicht, nur die Fahrtkosten werden ersetzt. „Ich mache das nicht für Geld“, sagt Frau Meier. „Meine eigenen Enkel wohnen in Kanada, ich sehe sie einmal im Jahr. Hier habe ich wieder Kinderlachen im Alltag.“\n\nWer als Leihoma oder Leihopa mitmachen will, muss ein polizeiliches Führungszeugnis vorlegen und an einem Gespräch mit dem Verein teilnehmen. Danach werden Familie und Senioren behutsam zusammengebracht: erst ein Kaffee, dann ein gemeinsamer Nachmittag. Die Nachfrage ist allerdings größer als das Angebot. Familien müssen zurzeit etwa ein halbes Jahr warten, bis sich eine passende Person findet. Der Verein sucht deshalb dringend weitere Freiwillige ab sechzig.",
          "items": [
            {"id": "L2-1", "question": "Der Verein in Münster …", "options": ["bringt ältere Menschen mit Familien zusammen, deren Großeltern weit weg wohnen.", "sucht Großeltern, die Geld verdienen möchten.", "bietet Kurse für Großeltern an."], "answer": 0, "skill": "global"},
            {"id": "L2-2", "question": "Frau Meier …", "options": ["bekommt für ihre Hilfe ein Gehalt.", "holt die Kinder einmal pro Woche von der Kita ab.", "sieht ihre eigenen Enkel jede Woche."], "answer": 1, "skill": "detail"},
            {"id": "L2-3", "question": "Familien, die mitmachen möchten, …", "options": ["müssen ein Führungszeugnis vorlegen.", "bekommen sofort eine Leihoma.", "müssen oft ein halbes Jahr warten."], "answer": 2, "skill": "number-time"}
          ]
        },
        {
          "title": "Freundschaft braucht Termine",
          "source": "Zeitschrift",
          "text": "Wie viele enge Freunde hat ein Erwachsener in Deutschland? Im Durchschnitt 3,7 – das zeigt eine neue Umfrage mit über 2000 Teilnehmern. Interessant ist ein anderes Ergebnis: Ab dem dreißigsten Lebensjahr wird es deutlich schwieriger, Freundschaften zu pflegen. Beruf, Umzüge und Kinder lassen wenig Zeit, und viele Kontakte schlafen langsam ein.\n\n„Freundschaft ist wie eine Pflanze, die man gießen muss“, sagt die Psychologin Dr. Anja Berg. Studien zeigen, dass man ungefähr 200 gemeinsame Stunden braucht, bis aus einem Bekannten ein enger Freund wird. Ihr Rat klingt unromantisch, funktioniert aber: „Vereinbaren Sie feste Termine, so wie beim Sport oder beim Zahnarzt. Wer wartet, bis beide spontan Zeit haben, der wartet oft ein ganzes Jahr.“\n\nSven und Ali haben sich mit sechzehn im Fußballverein kennengelernt. Heute wohnen sie 300 Kilometer voneinander entfernt, beide haben Familie und wenig Zeit. Trotzdem telefonieren sie seit zwölf Jahren jeden Sonntag um 20 Uhr. „Nur zweimal ist das Gespräch ausgefallen, einmal war ich im Krankenhaus“, erzählt Ali. „Ohne den festen Termin hätten wir uns bestimmt aus den Augen verloren.“ Einmal im Jahr fahren die beiden außerdem zusammen zum Angeln, und zwar seit fünfzehn Jahren immer an denselben See.",
          "items": [
            {"id": "L2-4", "question": "Laut der Umfrage …", "options": ["haben die meisten Erwachsenen mehr als fünf enge Freunde.", "wird es nach dem dreißigsten Lebensjahr schwieriger, Freundschaften zu pflegen.", "haben Menschen mit Kindern die meisten Freunde."], "answer": 1, "skill": "paraphrase"},
            {"id": "L2-5", "question": "Frau Berg empfiehlt, …", "options": ["möglichst viele neue Leute kennenzulernen.", "Freunde nur zu besonderen Anlässen zu treffen.", "feste Termine mit Freunden zu vereinbaren."], "answer": 2, "skill": "paraphrase"},
            {"id": "L2-6", "question": "Sven und Ali …", "options": ["telefonieren seit Jahren jede Woche zur gleichen Zeit.", "wohnen in derselben Stadt.", "haben sich im Krankenhaus kennengelernt."], "answer": 0, "skill": "detail"}
          ]
        }
      ]
    },
    "teil3": {
      "intro": "Einige Personen aus Ihrem Deutschkurs suchen Angebote rund um Familie und Freundschaft. Lesen Sie die Situationen 1–7 und die Anzeigen A–J. Welche Anzeige passt zu welcher Situation? Eine Anzeige kann nur einmal gewählt werden. Für eine Situation gibt es keine passende Anzeige – markieren Sie dort 0.",
      "situations": [
        {"id": "L3-1", "text": "Julia (28) ist neu in der Stadt und möchte Leute in ihrem Alter kennenlernen.", "answer": "C", "skill": "matching"},
        {"id": "L3-2", "text": "Herr und Frau Weber suchen jemanden, der zweimal pro Woche nachmittags auf ihre Tochter (4) aufpasst.", "answer": "G", "skill": "matching"},
        {"id": "L3-3", "text": "Selma und ihr Mann streiten in letzter Zeit sehr oft und möchten mit einem Fachmann darüber sprechen.", "answer": "A", "skill": "matching"},
        {"id": "L3-4", "text": "Timo möchte seinen Großeltern zur goldenen Hochzeit ein persönliches Geschenk machen.", "answer": "I", "skill": "matching"},
        {"id": "L3-5", "text": "Karin (68) lebt allein und möchte am Sonntag nicht immer allein essen.", "answer": "E", "skill": "matching"},
        {"id": "L3-6", "text": "Aylins Vater (80) kann nicht mehr allein wohnen. Sie sucht ein Seniorenheim in der Nähe, in dem er auch nachts betreut wird.", "answer": null, "skill": "matching"},
        {"id": "L3-7", "text": "Daniel möchte in den Ferien mit seinen Kindern (7 und 10) etwas zusammen mit anderen Familien unternehmen.", "answer": "D", "skill": "matching"}
      ],
      "ads": [
        {"letter": "A", "title": "Paarberatung – bevor es zu spät ist", "text": "Streit, Schweigen, Missverständnisse? Unsere Psychologinnen helfen Paaren, wieder miteinander zu reden. Erstgespräch kostenlos, danach 60 € pro Stunde. Termine auch abends. Beratungsstelle Familie & Partnerschaft, Tel. 0251 / 44 55 66."},
        {"letter": "B", "title": "Kindergeburtstag im Zoo", "text": "Feiern zwischen Affen und Pinguinen! Zwei Stunden Führung, Tierfütterung und Geburtstagstisch im Zoo-Café. Für Kinder von 5 bis 12 Jahren, max. 10 Kinder. 180 € inkl. Eintritt. Buchung: feiern@zoo-nord.de"},
        {"letter": "C", "title": "Stammtisch „Neu in der Stadt“", "text": "Du bist gerade hergezogen und kennst noch niemanden? Wir treffen uns jeden Donnerstag um 19:30 Uhr im Café Nordstern. Offene Runde, 20 bis 35 Jahre, jeder ist willkommen. Einfach vorbeikommen!"},
        {"letter": "D", "title": "Familien-Zeltwochenende am See", "text": "Drei Tage Natur mit anderen Familien: Lagerfeuer, Kanufahren, Nachtwanderung. Für Eltern mit Kindern von 6 bis 14 Jahren. 90 € pro Familie inkl. Verpflegung, Zelte vorhanden. In den Herbstferien, Anmeldung beim Jugendwerk."},
        {"letter": "E", "title": "Sonntagstisch im Gemeindezentrum", "text": "Niemand soll allein essen! Jeden Sonntag um 12:30 Uhr kochen Freiwillige ein Drei-Gänge-Menü für alle, die Gesellschaft suchen. 5 € pro Person, Anmeldung bis Freitag unter 0251 / 77 88 99. Fahrdienst auf Anfrage."},